Microsoft Windows [Version 10.0.22000.318]
(c) Microsoft Corporation. All rights reserved.

//=========Login SQL Server==========

C:\xampp\mysql\bin>mysql --user=root --password=
Welcome to the MariaDB monitor.  Commands end with ; or \g.
Your MariaDB connection id is 8
Server version: 10.4.18-MariaDB mariadb.org binary distribution

Copyright (c) 2000, 2018, Oracle, MariaDB Corporation Ab and others.

Type 'help;' or '\h' for help. Type '\c' to clear the current input statement.

//=======Show All Exesting Database Name In Available In SQL Server=========

MariaDB [(none)]> SHOW DATABASES;
+--------------------+
| Database           |
+--------------------+
| food_ordering      |
| information_schema |
| mysql              |
| online_food        |
| performance_schema |
| phpmyadmin         |
| test               |
+--------------------+
7 rows in set (0.004 sec)

//============Creating Our Project Database===========

MariaDB [(none)]> CREATE DATABASE mess_managment;
Query OK, 1 row affected (0.002 sec)

//===========Show All Database Created Available in SQL Server=====

MariaDB [(none)]> SHOW DATABASES;
+--------------------+
| Database           |
+--------------------+
| food_ordering      |
| information_schema |
| mess_managment     |
| mysql              |
| online_food        |
| performance_schema |
| phpmyadmin         |
| test               |
+--------------------+
8 rows in set (0.001 sec)

//==========Use Our Project Database mess_management============

MariaDB [(none)]> USE mess_managment
Database changed

//========Display All Table Available in Our Project Database========

//====Initial The mess_management Database contains no table (Empty)========

MariaDB [mess_managment]> SHOW TABLES;
Empty set (0.001 sec)

//========Remove Database mess_management============

MariaDB [mess_managment]> DROP DATABASE mess_managment;
Query OK, 0 rows affected (0.014 sec)

//=======Check Database Remove or Not=========

MariaDB [(none)]> SHOW DATABASES;
+--------------------+
| Database           |
+--------------------+
| food_ordering      |
| information_schema |
| mysql              |
| online_food        |
| performance_schema |
| phpmyadmin         |
| test               |
+--------------------+
7 rows in set (0.001 sec)

MariaDB [(none)]>

//======Once Again Create Database mess_management======

MariaDB [(none)]> CREATE DATABASE mess_management;
Query OK, 1 row affected (0.002 sec)

//====Check Database Created Or Not======

MariaDB [(none)]> SHOW DATABASES;
+--------------------+
| Database           |
+--------------------+
| food_ordering      |
| information_schema |
| mess_management    |
| mysql              |
| online_food        |
| performance_schema |
| phpmyadmin         |
| test               |
+--------------------+
8 rows in set (0.001 sec)

//======Use Created Database mess_management======

MariaDB [(none)]> USE mess_management;
Database changed

//====Cheack Database Empty or Note=====

MariaDB [mess_management]> SHOW TABLES;
Empty set (0.001 sec)

//====Create Table For Mess Members======

MariaDB [mess_management]> CREATE TABLE `members` (
    ->  `id` int(11) NOT NULL PRIMARY KEY,
    ->  `name` varchar(50) NOT NULL,
    ->  `email_id` varchar(100) NOT NULL,
    ->  `contact_no` varchar(15) NOT NULL,
    ->  `address` varchar(255) NOT NULL,
    ->  `roll` varchar(50) NOT NULL,
    ->  `added_on` timestamp NOT NULL DEFAULT current_timestamp() ON UPDATE current_timestamp(),
    ->  `status` tinyint(4) NOT NULL
    -> );
Query OK, 0 rows affected (0.014 sec)

//=====Show All Tables meains checking member table created or not====

MariaDB [mess_management]> SHOW TABLES;
+---------------------------+
| Tables_in_mess_management |
+---------------------------+
| members                   |
+---------------------------+
1 row in set (0.002 sec)

//====Display All fields Info In Mess Members Table====

MariaDB [mess_management]> show fields from members;
+------------+--------------+------+-----+---------------------+-------------------------------+
| Field      | Type         | Null | Key | Default             | Extra                         |
+------------+--------------+------+-----+---------------------+-------------------------------+
| id         | int(11)      | NO   | PRI | NULL                |                               |
| name       | varchar(50)  | NO   |     | NULL                |                               |
| email_id   | varchar(100) | NO   |     | NULL                |                               |
| contact_no | varchar(15)  | NO   |     | NULL                |                               |
| address    | varchar(255) | NO   |     | NULL                |                               |
| roll       | varchar(50)  | NO   |     | NULL                |                               |
| added_on   | timestamp    | NO   |     | current_timestamp() | on update current_timestamp() |
| status     | tinyint(4)   | NO   |     | NULL                |                               |
+------------+--------------+------+-----+---------------------+-------------------------------+
8 rows in set (0.006 sec)

//=======Cheack in member table any row inserted or not=====

MariaDB [mess_management]> SELECT * FROM `members`;
Empty set (0.003 sec)

//====Creating Table for Menting the Mess Fees Submition Record====

MariaDB [mess_management]> CREATE TABLE `mess_expense` (
    -> `id` int(11) NOT NULL,
    -> `mem_id` int(11) NOT NULL,
    -> `pay_date` timestamp NOT NULL DEFAULT current_timestamp() ON UPDATE current_timestamp(),
    -> `amounts` varchar(50) NOT NULL
    -> );
Query OK, 0 rows affected (0.060 sec)

//=======Cheack mess_expanse table created or not========

MariaDB [mess_management]> SHOW TABLES;
+---------------------------+
| Tables_in_mess_management |
+---------------------------+
| members                   |
| mess_expense              |
+---------------------------+
2 rows in set (0.001 sec)

//======Display All Fields inserted in mess_expense table=====

MariaDB [mess_management]> SHOW FIELDS FROM mess_expense;
+----------+-------------+------+-----+---------------------+-------------------------------+
| Field    | Type        | Null | Key | Default             | Extra                         |
+----------+-------------+------+-----+---------------------+-------------------------------+
| id       | int(11)     | NO   |     | NULL                |                               |
| mem_id   | int(11)     | NO   |     | NULL                |                               |
| pay_date | timestamp   | NO   |     | current_timestamp() | on update current_timestamp() |
| amounts  | varchar(50) | NO   |     | NULL                |                               |
+----------+-------------+------+-----+---------------------+-------------------------------+
4 rows in set (0.057 sec)

//====Modify mess_expanse table id Add as a primary key=====

MariaDB [mess_management]> ALTER TABLE `mess_expense`
    ->   ADD PRIMARY KEY (`id`);
Query OK, 0 rows affected (0.072 sec)

//=====Modify mess_expanse table id is Auto increment=====

MariaDB [mess_management]> ALTER TABLE `mess_expense`
    ->   MODIFY `id` int(11) NOT NULL AUTO_INCREMENT;
Query OK, 0 rows affected (0.078 sec)

//======Display fileds in mess_expance table changes done or note====

MariaDB [mess_management]>  SHOW FIELDS FROM mess_expense;
+----------+-------------+------+-----+---------------------+-------------------------------+
| Field    | Type        | Null | Key | Default             | Extra                         |
+----------+-------------+------+-----+---------------------+-------------------------------+
| id       | int(11)     | NO   | PRI | NULL                | auto_increment                |
| mem_id   | int(11)     | NO   |     | NULL                |                               |
| pay_date | timestamp   | NO   |     | current_timestamp() | on update current_timestamp() |
| amounts  | varchar(50) | NO   |     | NULL                |                               |
+----------+-------------+------+-----+---------------------+-------------------------------+
4 rows in set (0.057 sec)

//=====Creating Second Table For Mess Attendance Purpose=====

MariaDB [mess_management]> CREATE TABLE `attendance` (
    ->   `id` int(11) NOT NULL,
    ->   `mem_id` int(11) NOT NULL,
    ->   `date` timestamp NOT NULL DEFAULT current_timestamp() ON UPDATE current_timestamp(),
    ->   `type` varchar(50) NOT NULL
    -> );
Query OK, 0 rows affected (0.059 sec)

//======Cheack attendance table is created or note=======

MariaDB [mess_management]>  SHOW TABLES;
+---------------------------+
| Tables_in_mess_management |
+---------------------------+
| attendance                |
| members                   |
| mess_expense              |
+---------------------------+
3 rows in set (0.001 sec)

//==========Display All Filleds detailes in attendance table==========

MariaDB [mess_management]> SHOW FIELDS FROM  attendance;
+--------+-------------+------+-----+---------------------+-------------------------------+
| Field  | Type        | Null | Key | Default             | Extra                         |
+--------+-------------+------+-----+---------------------+-------------------------------+
| id     | int(11)     | NO   |     | NULL                |                               |
| mem_id | int(11)     | NO   |     | NULL                |                               |
| date   | timestamp   | NO   |     | current_timestamp() | on update current_timestamp() |
| type   | varchar(50) | NO   |     | NULL                |                               |
+--------+-------------+------+-----+---------------------+-------------------------------+
4 rows in set (0.008 sec)

//========Add Attendance table id is primary Key=====

MariaDB [mess_management]> ALTER TABLE `attendance`
    ->   ADD PRIMARY KEY (`id`);
Query OK, 0 rows affected (0.074 sec)
Records: 0  Duplicates: 0  Warnings: 0

//=====Modified id is set Auto Increment======

MariaDB [mess_management]> ALTER TABLE `attendance`
    ->   MODIFY `id` int(11) NOT NULL AUTO_INCREMENT;
Query OK, 0 rows affected (0.079 sec)
Records: 0  Duplicates: 0  Warnings: 0

//=====Again Display All Fileds in attendance table Changes is Done or Not====

MariaDB [mess_management]> SHOW FIELDS FROM  attendance;
+--------+-------------+------+-----+---------------------+-------------------------------+
| Field  | Type        | Null | Key | Default             | Extra                         |
+--------+-------------+------+-----+---------------------+-------------------------------+
| id     | int(11)     | NO   | PRI | NULL                | auto_increment                |
| mem_id | int(11)     | NO   |     | NULL                |                               |
| date   | timestamp   | NO   |     | current_timestamp() | on update current_timestamp() |
| type   | varchar(50) | NO   |     | NULL                |                               |
+--------+-------------+------+-----+---------------------+-------------------------------+
4 rows in set (0.057 sec)

//=======Create Mess Member means insert data to member table======

MariaDB [mess_management]> INSERT INTO `members` (`name`, `email_id`, `contact_no`, `address`, `roll`,`status`) VALUES ('pruthviraj rajput', 'pruthvrajrajput011@gmail.com', '+918767286769', 'shahada', 'member', '1');
Query OK, 1 row affected, 1 warning (0.053 sec)

//=======Retrieve Data For Cheacking Data Inserted Or Note=========

MariaDB [mess_management]> SELECT * FROM `members`;
+----+-------------------+------------------------------+---------------+---------+--------+---------------------+--------+
| id | name              | email_id                     | contact_no    | address | roll   | added_on            | status |
+----+-------------------+------------------------------+---------------+---------+--------+---------------------+--------+
|  1 | pruthviraj rajput | pruthvrajrajput011@gmail.com | +918767286769 | shahada | member | 2021-12-15 14:33:00 |      1 |
+----+-------------------+------------------------------+---------------+---------+--------+---------------------+--------+
1 row in set (0.001 sec)

//======Inserting Some Row in members table===========

MariaDB [mess_management]>  INSERT INTO `members` (`name`, `email_id`, `contact_no`, `address`, `roll`,`status`) VALUES ('Raj rajput', 'rajrajput@gmail.com', '+911234567890', 'shirpure', 'member', '1');
Query OK, 1 row affected (0.051 sec)

MariaDB [mess_management]> INSERT INTO `members` (`name`, `email_id`, `contact_no`, `address`, `roll`,`status`) VALUES ('Raj rajput', 'rajrajput@gmail.com', '+911234567890', 'shirpure', 'member', '1');
Query OK, 1 row affected (0.052 sec)

MariaDB [mess_management]> INSERT INTO `members` (`name`, `email_id`, `contact_no`, `address`, `roll`,`status`) VALUES ('Krushnali Rajput', 'krushnalirajput@gmail.com', '+911234567890', 'shirpur', 'member', '1');
Query OK, 1 row affected (0.017 sec)

MariaDB [mess_management]> INSERT INTO `members` (`name`, `email_id`, `contact_no`, `address`, `roll`,`status`) VALUES ('Harshada Patil', 'harshadapatil@gmail.com', '+911234567894', 'shirpur', 'member', '1');
Query OK, 1 row affected (0.003 sec)

//===========Retrieve Data Form members Database==========

MariaDB [mess_management]> SELECT * FROM `members`;
+----+-------------------+------------------------------+---------------+----------+--------+---------------------+--------+
| id | name              | email_id                     | contact_no    | address  | roll   | added_on            | status |
+----+-------------------+------------------------------+---------------+----------+--------+---------------------+--------+
|  1 | pruthviraj rajput | pruthvrajrajput011@gmail.com | +918767286769 | shahada  | member | 2021-12-15 14:33:00 |      1 |
|  2 | Raj rajput        | rajrajput@gmail.com          | +911234567890 | shirpure | member | 2021-12-15 14:44:53 |      1 |
|  3 | Raj rajput        | rajrajput@gmail.com          | +911234567890 | shirpure | member | 2021-12-15 14:45:58 |      1 |
|  4 | Krushnali Rajput  | krushnalirajput@gmail.com    | +911234567890 | shirpur  | member | 2021-12-15 14:50:17 |      1 |
|  5 | Kirti Patil       | kirtipatil@gmail.com         | +911234567891 | jalgaon  | member | 2021-12-15 14:52:02 |      1 |
|  6 | Manas Rajput      | manasrajput@gmail.com        | +911234567892 | shirpur  | member | 2021-12-15 14:52:47 |      1 |
|  7 | Harshada Patil    | harshadapatil@gmail.com      | +911234567894 | shirpur  | member | 2021-12-15 15:14:53 |      1 |
+----+-------------------+------------------------------+---------------+----------+--------+---------------------+--------+
7 rows in set (0.001 sec)

//===========Delete id=>1 or id=>2 Rows============

MariaDB [mess_management]> DELETE FROM `members` WHERE `id` = 1;
Query OK, 1 row affected (0.002 sec)

MariaDB [mess_management]> DELETE FROM `members` WHERE `id` = 2;
Query OK, 1 row affected (0.002 sec)

//=======Retrivew members table data after deleting two rows id=>1 and 2=======

MariaDB [mess_management]> SELECT * FROM `members`;
+----+------------------+---------------------------+---------------+----------+--------+---------------------+--------+
| id | name             | email_id                  | contact_no    | address  | roll   | added_on            | status |
+----+------------------+---------------------------+---------------+----------+--------+---------------------+--------+
|  3 | Raj rajput       | rajrajput@gmail.com       | +911234567890 | shirpure | member | 2021-12-15 14:45:58 |      1 |
|  4 | Krushnali Rajput | krushnalirajput@gmail.com | +911234567890 | shirpur  | member | 2021-12-15 14:50:17 |      1 |
|  5 | Kirti Patil      | kirtipatil@gmail.com      | +911234567891 | jalgaon  | member | 2021-12-15 14:52:02 |      1 |
|  6 | Manas Rajput     | manasrajput@gmail.com     | +911234567892 | shirpur  | member | 2021-12-15 14:52:47 |      1 |
|  7 | Harshada Patil   | harshadapatil@gmail.com   | +911234567894 | shirpur  | member | 2021-12-15 15:14:53 |      1 |
+----+------------------+---------------------------+---------------+----------+--------+---------------------+--------+
5 rows in set (0.001 sec)

//==========Insert one row in  members==========

MariaDB [mess_management]>  INSERT INTO `members` (`name`, `email_id`, `contact_no`, `address`, `roll`,`status`) VALUES ('pruthviraj rajput', 'pruthvrajrajput011@gmail.com', '+918767286769', 'shahada', 'member', '1');
Query OK, 1 row affected (0.050 sec)

//========Show Inserted Rows meains Data=========

MariaDB [mess_management]> SELECT * FROM `members`;
+----+-------------------+------------------------------+---------------+----------+--------+---------------------+--------+
| id | name              | email_id                     | contact_no    | address  | roll   | added_on            | status |
+----+-------------------+------------------------------+---------------+----------+--------+---------------------+--------+
|  3 | Raj rajput        | rajrajput@gmail.com          | +911234567890 | shirpure | member | 2021-12-15 14:45:58 |      1 |
|  4 | Krushnali Rajput  | krushnalirajput@gmail.com    | +911234567890 | shirpur  | member | 2021-12-15 14:50:17 |      1 |
|  5 | Kirti Patil       | kirtipatil@gmail.com         | +911234567891 | jalgaon  | member | 2021-12-15 14:52:02 |      1 |
|  6 | Manas Rajput      | manasrajput@gmail.com        | +911234567892 | shirpur  | member | 2021-12-15 14:52:47 |      1 |
|  7 | Harshada Patil    | harshadapatil@gmail.com      | +911234567894 | shirpur  | member | 2021-12-15 15:14:53 |      1 |
|  8 | pruthviraj rajput | pruthvrajrajput011@gmail.com | +918767286769 | shahada  | member | 2021-12-15 16:17:44 |      1 |
+----+-------------------+------------------------------+---------------+----------+--------+---------------------+--------+
6 rows in set (0.001 sec)

//=====Edit member table id of 8 pruthviraj rajput to Manas Jadhav=====

MariaDB [mess_management]>  UPDATE `members` SET `name` = 'Manas Jadhav' WHERE `id` = 8;
Query OK, 1 row affected (0.004 sec)
Rows matched: 1  Changed: 1  Warnings: 0

//======Retrieve members table data id 8 updated or not=====

MariaDB [mess_management]> SELECT * FROM `members`;
+----+------------------+------------------------------+---------------+----------+--------+---------------------+--------+
| id | name             | email_id                     | contact_no    | address  | roll   | added_on            | status |
+----+------------------+------------------------------+---------------+----------+--------+---------------------+--------+
|  3 | Raj rajput       | rajrajput@gmail.com          | +911234567890 | shirpure | member | 2021-12-15 14:45:58 |      1 |
|  4 | Krushnali Rajput | krushnalirajput@gmail.com    | +911234567890 | shirpur  | member | 2021-12-15 14:50:17 |      1 |
|  5 | Kirti Patil      | kirtipatil@gmail.com         | +911234567891 | jalgaon  | member | 2021-12-15 14:52:02 |      1 |
|  6 | Manas Rajput     | manasrajput@gmail.com        | +911234567892 | shirpur  | member | 2021-12-15 14:52:47 |      1 |
|  7 | Harshada Patil   | harshadapatil@gmail.com      | +911234567894 | shirpur  | member | 2021-12-15 15:14:53 |      1 |
|  8 | Manas Jadhav     | pruthvrajrajput011@gmail.com | +918767286769 | shahada  | member | 2021-12-15 16:26:29 |      1 |
+----+------------------+------------------------------+---------------+----------+--------+---------------------+--------+
6 rows in set (0.001 sec)

//===========For Login We Get Only one Member data basis of email and contact number=========

MariaDB [mess_management]> SELECT * FROM `members` WHERE `email_id`= 'pruthvrajrajput011@gmail.com' AND `contact_no`='+918767286769';
+----+--------------+------------------------------+---------------+---------+--------+---------------------+--------+
| id | name         | email_id                     | contact_no    | address | roll   | added_on            | status |
+----+--------------+------------------------------+---------------+---------+--------+---------------------+--------+
|  8 | Manas Jadhav | pruthvrajrajput011@gmail.com | +918767286769 | shahada | member | 2021-12-15 16:26:29 |      1 |
+----+--------------+------------------------------+---------------+---------+--------+---------------------+--------+
1 row in set (0.001 sec)

//==============Display All Table In mess_managment database========

MariaDB [mess_management]> SHOW TABLES;
+---------------------------+
| Tables_in_mess_management |
+---------------------------+
| attendance                |
| members                   |
| mess_expense              |
+---------------------------+
3 rows in set (0.001 sec)

//==========Use For Attendance Table for Mess Atandaance============

MariaDB [mess_management]> SELECT * FROM `attendance`;
Empty set (0.031 sec)

//==========Attendence Table Failed Display============

MariaDB [mess_management]> SHOW FIELDS FROM  attendance;
+--------+-------------+------+-----+---------------------+-------------------------------+
| Field  | Type        | Null | Key | Default             | Extra                         |
+--------+-------------+------+-----+---------------------+-------------------------------+
| id     | int(11)     | NO   | PRI | NULL                | auto_increment                |
| mem_id | int(11)     | NO   |     | NULL                |                               |
| date   | timestamp   | NO   |     | current_timestamp() | on update current_timestamp() |
| type   | varchar(50) | NO   |     | NULL                |                               |
+--------+-------------+------+-----+---------------------+-------------------------------+
4 rows in set (0.013 sec)

//==========Mark Attendance Member Id=>4===========

MariaDB [mess_management]> INSERT INTO `attendance` (`mem_id`,`type`) VALUES ('4','Dinner');
Query OK, 1 row affected (0.009 sec)

//=====Get Attendance Table attendance is Mark or note=======

MariaDB [mess_management]> SELECT * FROM `attendance`;
+----+--------+---------------------+--------+
| id | mem_id | date                | type   |
+----+--------+---------------------+--------+
|  1 |      4 | 2021-12-15 16:48:08 | Dinner |
+----+--------+---------------------+--------+
1 row in set (0.001 sec)

//=========Marks Few Attendance=========

MariaDB [mess_management]> INSERT INTO `attendance` (`mem_id`,`type`) VALUES ('4','breakfast');
Query OK, 1 row affected (0.135 sec)

MariaDB [mess_management]>  INSERT INTO `attendance` (`mem_id`,`type`) VALUES ('3','Dinner');
Query OK, 1 row affected (0.008 sec)

MariaDB [mess_management]>  INSERT INTO `attendance` (`mem_id`,`type`) VALUES ('8','Dinner');
Query OK, 1 row affected (0.051 sec)

MariaDB [mess_management]>  INSERT INTO `attendance` (`mem_id`,`type`) VALUES ('5','Dinner');
Query OK, 1 row affected (0.008 sec)

MariaDB [mess_management]>  INSERT INTO `attendance` (`mem_id`,`type`) VALUES ('6','Dinner');
Query OK, 1 row affected (0.008 sec)

MariaDB [mess_management]>  INSERT INTO `attendance` (`mem_id`,`type`) VALUES ('7','Dinner');
Query OK, 1 row affected (0.008 sec)

MariaDB [mess_management]> INSERT INTO `attendance` (`mem_id`,`type`) VALUES ('3','breakfast');
Query OK, 1 row affected (0.002 sec)

MariaDB [mess_management]> INSERT INTO `attendance` (`mem_id`,`type`) VALUES ('5','breakfast');
Query OK, 1 row affected (0.008 sec)

MariaDB [mess_management]> INSERT INTO `attendance` (`mem_id`,`type`) VALUES ('6','breakfast');
Query OK, 1 row affected (0.009 sec)

MariaDB [mess_management]> INSERT INTO `attendance` (`mem_id`,`type`) VALUES ('7','breakfast');
Query OK, 1 row affected (0.008 sec)

//===============Get All Atendance Marks Data==============

MariaDB [mess_management]> SELECT * FROM `attendance`;
+----+--------+---------------------+-----------+
| id | mem_id | date                | type      |
+----+--------+---------------------+-----------+
|  1 |      4 | 2021-12-15 16:48:08 | Dinner    |
|  2 |      4 | 2021-12-15 16:51:23 | breakfast |
|  3 |      3 | 2021-12-15 16:51:42 | Dinner    |
|  4 |      8 | 2021-12-15 16:51:49 | Dinner    |
|  5 |      5 | 2021-12-15 16:52:07 | Dinner    |
|  6 |      6 | 2021-12-15 16:52:14 | Dinner    |
|  7 |      7 | 2021-12-15 16:52:20 | Dinner    |
|  8 |      3 | 2021-12-15 16:52:50 | breakfast |
|  9 |      5 | 2021-12-15 16:52:58 | breakfast |
| 10 |      6 | 2021-12-15 16:53:06 | breakfast |
| 11 |      7 | 2021-12-15 16:53:13 | breakfast |
+----+--------+---------------------+-----------+
11 rows in set (0.001 sec)

//=========Get Member Id Number 4 Attendance Data==========

MariaDB [mess_management]> SELECT * FROM `attendance` WHERE `mem_id` =4;
+----+--------+---------------------+-----------+
| id | mem_id | date                | type      |
+----+--------+---------------------+-----------+
|  1 |      4 | 2021-12-15 16:48:08 | Dinner    |
|  2 |      4 | 2021-12-15 16:51:23 | breakfast |
+----+--------+---------------------+-----------+
2 rows in set (0.001 sec)

//=========Get Member Id Number 8 Attendance Data==========

MariaDB [mess_management]> SELECT * FROM `attendance` WHERE `mem_id` = 8;
+----+--------+---------------------+--------+
| id | mem_id | date                | type   |
+----+--------+---------------------+--------+
|  4 |      8 | 2021-12-15 16:51:49 | Dinner |
+----+--------+---------------------+--------+
1 row in set (0.001 sec)

//=======Get Table from mess_managment Database=========

MariaDB [mess_management]> SHOW TABLES;
+---------------------------+
| Tables_in_mess_management |
+---------------------------+
| attendance                |
| members                   |
| mess_expense              |
+---------------------------+
3 rows in set (0.001 sec)


//=========Fields mess_expance Table===========

MariaDB [mess_management]>  SHOW FIELDS FROM  `mess_expense`;
+----------+-------------+------+-----+---------------------+-------------------------------+
| Field    | Type        | Null | Key | Default             | Extra                         |
+----------+-------------+------+-----+---------------------+-------------------------------+
| id       | int(11)     | NO   | PRI | NULL                | auto_increment                |
| mem_id   | int(11)     | NO   |     | NULL                |                               |
| pay_date | timestamp   | NO   |     | current_timestamp() | on update current_timestamp() |
| amounts  | varchar(50) | NO   |     | NULL                |                               |
+----------+-------------+------+-----+---------------------+-------------------------------+
4 rows in set (0.016 sec)

//=========Get Rows from mess_expense==========

MariaDB [mess_management]> SELECT * FROM `mess_expense`;
Empty set (0.191 sec)

//=======Insert Data To mess_expanse Table=========

MariaDB [mess_management]> INSERT INTO `mess_expense` (`mem_id`,`amounts`) VALUES ('4','18000');
Query OK, 1 row affected (0.037 sec)

//=======Get Rows From mess_expense Table=======

MariaDB [mess_management]> SELECT * FROM `mess_expense`;
+----+--------+---------------------+---------+
| id | mem_id | pay_date            | amounts |
+----+--------+---------------------+---------+
|  1 |      4 | 2021-12-15 17:20:26 | 18000   |
+----+--------+---------------------+---------+
1 row in set (0.001 sec)

//==========Insert Some More Rows========

MariaDB [mess_management]>  INSERT INTO `mess_expense` (`mem_id`,`amounts`) VALUES ('3','1800');
Query OK, 1 row affected (0.052 sec)

MariaDB [mess_management]>  INSERT INTO `mess_expense` (`mem_id`,`amounts`) VALUES ('5','18000');
Query OK, 1 row affected (0.052 sec)

MariaDB [mess_management]>  INSERT INTO `mess_expense` (`mem_id`,`amounts`) VALUES ('6','18000');
Query OK, 1 row affected (0.052 sec)

MariaDB [mess_management]>  INSERT INTO `mess_expense` (`mem_id`,`amounts`) VALUES ('8','1800');
Query OK, 1 row affected (0.051 sec)

MariaDB [mess_management]>  INSERT INTO `mess_expense` (`mem_id`,`amounts`) VALUES ('8','1800');
Query OK, 1 row affected (0.051 sec)

//=========Get All Rows From mess_expense Table=======

MariaDB [mess_management]> SELECT * FROM `mess_expense`;
+----+--------+---------------------+---------+
| id | mem_id | pay_date            | amounts |
+----+--------+---------------------+---------+
|  1 |      4 | 2021-12-15 17:20:26 | 18000   |
|  2 |      3 | 2021-12-15 17:24:16 | 1800    |
|  3 |      5 | 2021-12-15 17:24:29 | 18000   |
|  4 |      6 | 2021-12-15 17:24:35 | 18000   |
|  5 |      8 | 2021-12-15 17:24:49 | 1800    |
|  6 |      8 | 2021-12-15 17:24:59 | 1800    |
+----+--------+---------------------+---------+
6 rows in set (0.001 sec)

//======Update mem_id => 4,5,6=====

MariaDB [mess_management]> UPDATE `mess_expense` SET `amounts` = '1800' WHERE `mem_id` = 4;
Query OK, 1 row affected (0.052 sec)
Rows matched: 1  Changed: 1  Warnings: 0

MariaDB [mess_management]> UPDATE `mess_expense` SET `amounts` = '1800' WHERE `mem_id` = 5;
Query OK, 1 row affected (0.002 sec)
Rows matched: 1  Changed: 1  Warnings: 0

MariaDB [mess_management]> UPDATE `mess_expense` SET `amounts` = '1800' WHERE `mem_id` = 6;
Query OK, 1 row affected (0.052 sec)
Rows matched: 1  Changed: 1  Warnings: 0

//======Display All Rows From mess_expense table for cheacking database update or note===

MariaDB [mess_management]> SELECT * FROM `mess_expense`;
+----+--------+---------------------+---------+
| id | mem_id | pay_date            | amounts |
+----+--------+---------------------+---------+
|  1 |      4 | 2021-12-15 17:28:24 | 1800    |
|  2 |      3 | 2021-12-15 17:24:16 | 1800    |
|  3 |      5 | 2021-12-15 17:28:50 | 1800    |
|  4 |      6 | 2021-12-15 17:28:57 | 1800    |
|  5 |      8 | 2021-12-15 17:24:49 | 1800    |
|  6 |      8 | 2021-12-15 17:24:59 | 1800    |
+----+--------+---------------------+---------+
6 rows in set (0.001 sec)

//=======Display Specific Fees Detailes using Member id==========

MariaDB [mess_management]> SELECT * FROM `mess_expense` WHERE `mem_id`=4;
+----+--------+---------------------+---------+
| id | mem_id | pay_date            | amounts |
+----+--------+---------------------+---------+
|  1 |      4 | 2021-12-15 17:28:24 | 1800    |
+----+--------+---------------------+---------+
1 row in set (0.001 sec)



